{
  "$schema": "http://json-schema.org/draft-07/schema#",
  "$id": "https://github.com/bjl13/open-cognition/schemas/canonical_object.schema.json",
  "title": "CanonicalObject",
  "description": "An immutable, content-addressed record. The truth layer. Once written, never modified.",
  "type": "object",
  "required": [
    "schema_version",
    "id",
    "object_type",
    "content_type",
    "size_bytes",
    "created_at",
    "created_by",
    "storage_path"
  ],
  "additionalProperties": false,
  "properties": {
    "schema_version": {
      "type": "string",
      "const": "0.1.0",
      "description": "Schema version. Must be '0.1.0' for this version of the spec."
    },
    "id": {
      "type": "string",
      "pattern": "^sha256:[0-9a-f]{64}$",
      "description": "Content-addressed identity: sha256:<hex-digest> of the stored payload bytes. This IS the object — the same payload always produces the same id."
    },
    "object_type": {
      "type": "string",
      "enum": ["observation", "document", "tool_output", "policy"],
      "description": "Semantic category of this canonical object."
    },
    "content_type": {
      "type": "string",
      "description": "MIME type of the stored payload (e.g. 'application/json', 'text/plain')."
    },
    "size_bytes": {
      "type": "integer",
      "minimum": 0,
      "description": "Byte length of the stored payload. Must match the actual stored object."
    },
    "created_at": {
      "type": "string",
      "format": "date-time",
      "description": "ISO 8601 UTC timestamp of first submission. Immutable once set."
    },
    "created_by": {
      "type": "string",
      "minLength": 1,
      "description": "Identifier of the agent or human who submitted this object."
    },
    "storage_path": {
      "type": "string",
      "pattern": "^canonical/[a-z_]+/[0-9]{4}/[0-9]{2}/[0-9]{2}/sha256:[0-9a-f]{64}\\.json$",
      "description": "Deterministic path in object storage. Format: canonical/{object_type}/{yyyy}/{mm}/{dd}/{id}.json"
    },
    "metadata": {
      "type": "object",
      "description": "Optional free-form context. Not used for identity or content verification.",
      "additionalProperties": true
    }
  }
}
